{"schema_version": 1, "id": "train-a", "kind": "job", "state": "running", "updated_at": "2026-10-15T05:30:00Z", "heartbeat_interval_s": 30, "device_uuids": ["GPU-00000000-0000-0000-0000-000000000001"], "started_at": "2026-10-15T04:00:00Z", "artifacts": ["C:/runs/s2/checkpoints", "/data/s2/log.txt"]}
